{
  "contractVersion": "1.0",
  "resultId": "result-change-cancelled-001",
  "requestId": "req-20260830-change-001",
  "requestFingerprint": {
    "algorithm": "sha256-jcs-v1",
    "value": "sha256:44340c327366e5c0c78780634343b74720dfff72be25e70a4cfff87b23bbb6e7"
  },
  "taskId": "task-20260830-change-001",
  "stateRef": {
    "stateRevision": 4,
    "transitionId": "transition-cancelled-001",
    "emissionSequence": 1
  },
  "reportedAt": "2026-08-30T09:30:10-03:00",
  "status": "cancelled",
  "summary": "O cliente cancelou a tarefa antes da primeira alteração; o checkpoint de cancelamento foi preservado.",
  "criteria": [
    {
      "criterionId": "criterion-link-present",
      "status": "not-run",
      "evidenceRefs": []
    },
    {
      "criterionId": "criterion-scope-preserved",
      "status": "not-run",
      "evidenceRefs": []
    }
  ],
  "evidence": [
    {
      "evidenceId": "evidence-client-cancellation",
      "kind": "state-readback",
      "capturedAt": "2026-08-30T09:30:09-03:00",
      "summary": "O ledger confirmou o pedido de cancelamento antes de qualquer efeito externo.",
      "digest": "sha256:1404400c76e6e898a5537f9d351f49dd5fd7dd8a459b53d5f0d55b6d7b93c6ee",
      "artifactRefs": ["artifact-cancel-checkpoint"],
      "origin": {
        "kind": "runtime",
        "id": "overcore-runtime-v1"
      }
    }
  ],
  "artifacts": [
    {
      "artifactId": "artifact-cancel-checkpoint",
      "kind": "checkpoint",
      "uri": "urn:overcore:checkpoint:task-20260830-change-001:cancelled",
      "digest": "sha256:e158b0f74500be40a445efd629e74b7feacbf561f1766b432d9cbfca787e86e9",
      "mediaType": "application/json",
      "sensitivity": "internal",
      "createdAt": "2026-08-30T09:30:09-03:00"
    }
  ],
  "effects": [],
  "execution": {
    "attemptCount": 0,
    "maxParallelismObserved": 0,
    "durationMs": 10000,
    "finishedAt": "2026-08-30T09:30:10-03:00",
    "lastTransitionAt": "2026-08-30T09:30:10-03:00",
    "checkpointArtifactRef": "artifact-cancel-checkpoint"
  },
  "cancellation": {
    "code": "cancel-client-requested",
    "initiatedBy": "client",
    "summary": "O cliente solicitou a interrupção antes do início da execução.",
    "evidenceRefs": ["evidence-client-cancellation"]
  }
}
