{
  "contractVersion": "1.0",
  "resultId": "result-invalid-evidence-ref",
  "requestId": "req-20260830-inspection-001",
  "requestFingerprint": {
    "algorithm": "sha256-jcs-v1",
    "value": "sha256:33fcb5a04d18b6d00536ea6085bc36838b350ddd3058041ea741005069d306d6"
  },
  "taskId": "task-invalid-evidence-ref",
  "stateRef": {
    "stateRevision": 6,
    "transitionId": "transition-invalid-evidence",
    "emissionSequence": 1
  },
  "reportedAt": "2026-08-30T11:20:00-03:00",
  "status": "succeeded",
  "summary": "Este resultado é estruturalmente válido, mas aponta para evidência inexistente.",
  "criteria": [
    {
      "criterionId": "criterion-json-readable",
      "status": "passed",
      "evidenceRefs": ["evidence-does-not-exist"]
    },
    {
      "criterionId": "criterion-contract-closed",
      "status": "passed",
      "evidenceRefs": ["evidence-does-not-exist"]
    }
  ],
  "evidence": [],
  "artifacts": [],
  "effects": [],
  "execution": {
    "attemptCount": 1,
    "maxParallelismObserved": 1,
    "durationMs": 1000,
    "startedAt": "2026-08-30T11:19:59-03:00",
    "finishedAt": "2026-08-30T11:20:00-03:00",
    "lastTransitionAt": "2026-08-30T11:20:00-03:00"
  }
}
